question,answer
"Hi,
I am having 6 Years of experience in Dot net Technology. I want to do transition in Data Science field from Dot Net. How good it is for me with 6 Years of experience in dot net technology. And have completed M.C.A. in 2014.","Just study on,don't think of what you have or what you don't have. Studying with right attitude make things works."
"I want to know about certificates ,how they can be earned  please reply .",once you complete your assignments you are eligible for certificate( then you can just drop a mail to team@appliedaicourse.com )
"Lets say I finished the course - after one year period, will I have access to new content that are being added?","No, the validity is only 365 days."
"I really hope AAIC change this 365 day model. The course is expensive and I think of it as purchasing a product that I can use after one year period. Otherwise the price is just too high for something that can be considered as a rental. I do not mean any disrespect, I love teaching style of srikanth sir. He is an absolute brilliant is this field. I keep coming back to this site and pondering due to srikanth sir youtube sessions. I would jump in this course in a heart beat if you change your business model slightly (that is allow continued access to content after 1 year to loyal students)",Please send an email to team@appliedaicourse.com
I am international student - do you guys take paypal to enroll in ML course?,Please send an email to team@appliedaicourse.com
I am a commerce graduate and have Masters in Marketing Management with more than 10 years of experience in market research and consumer insights. Will this course help me if I want to make a transition into customer analytics side? Or is this course more relevant for engineers / science students only?,yes it can help if you can put long hours
Will I be able to watch the content after 1 year for revision purpose.,"No, but please drop a mail at team@appliedaicourse.com"
What's the validity of this course?,"The course validity is for 1 year. Within this 1 year, you are supposed to complete all the assignments."
"Hi team, Can i know the eligibility criteria for enrolling into this course","Please call us at 0-8106-920-029, so that we can clarify all your queries."
"in the windows application,clicking  'ctrl'+'-' has zoomed out of the web page but 'ctrl'+'+' is not zooming in . please help","Please try with ctrl + only, not ctrl ++."
Could you tell the average salary per annum the students received getting placed via this course please? Could you tell few companies where students got placed through this course?,"For companies, you can visit success stories page on our website. For other details, please send an email to team@appliedaicourse.com"
"Sir,I want to know am i get any certification after completing the course?","Yes, once after you finish all the assignments in this course and get them successful evaluated, you'll receive a course completion certificate from AppliedAI and you can add it on your resume."
"hello team,
while looking at some code , I came across something like this "" yield [ a , *b] "", where  a is an array and b = func()[some function]. what is the meaning of star(*) in this?",check this
"Hi Team,

 can i get some written notes/shorthand book type of things to revise time to time the completed topics ,also to quickly revise the topics before any interview.

Thanks
Binit",Please go to this link. We suggest to make your own notes as it helps better.
"Hi, there is a primary but important query. I have watched most of your free videos and I found it so useful than any other videos available on Youtube. Specially the teaching technique is so simple and comprehensive. For almost one and half years, I have been searching for a proper and easy way of understanding for Data science course keeping the course fees and job assurance in mind. Before taking the course,I want to let you know that currently I am working in a company and I want to pursue my career in Data science but I am weak in mathematics and I have no prior programming knowledge, But having all the contraries, I am not afraid of working hard if I get proper guidance. Please suggest me whether I should take this course or anything else advice you can give me. I would be grateful for this.",mathematics required for data science has been explained in simple language and we have python chapter required for data science too. it will be a good learning experience
"Hello Team,
i have seen object detection  using yolo v3 video and,  my question is: how to create labels for custom dataset?","Please refer these links : https://www.youtube.com/watch?v=EGQyDla8JNU
https://towardsdatascience.com/build-a-custom-trained-object-detection-model-with-5-lines-of-code-713ba7f6c0fb"
i justed joined this course today...can u plz tell me how and from where to start??,Please follow the syllabus don't skip any chapter.
"I have some doubts with question 7 of  Assignment 3(Mandatory Python):
The question was to smoothed the curve:
eg given: _, _, 30, _, _, _, 50, _, _
Sol: 10, 10, 12, 12, 12, 12, 4, 4, 4
My doubt is what about this case:
eg:  _, _, 30, _, _, _,40,150,60,30,_,_,50, _, _
What should the smoothed output here? Can you please help. If this is the wrong platform to ask assignment related questions? Can you please redirect it to me?",Please drop us a mail at team@appliedaicourse.com regarding assignments.
"Hello All , i just came across a nice open source 

https://github.com/eriklindernoren/ML-From-Scratch?fbclid=IwAR3KQPeeUxn8zWgv0zIyF9w_qxBepeJ3_y1LSgkNoDUcljcHKsja8MlCMrk#classification-with-cnn

might be helpful",Thanks for sharing.
In the 6th module do we build those projects shown as case study?,"Yes, we teach the concepts and ask you to perform similar other tasks."
Can i get this course for free somehow as i belong to a middle class family and i dont have the required funds to give a lot of money and i want to learn and i dont want the money become barrier in my education.,Please drop an email at team@appliedaicourse.com
What is the difficulty level of the assignments?,"If you understand the theory well, it is very easy to follow the step by step instructions given under each assignment."
where can i drop emails about doubts on assignments,You can send them to team@appliedaicourse.com
I have around 8+ experience in automotive and auto ancillary sector .Want to learn data science .I have done lots of search and final got ur course info. Hope the person like me with no experience of IT can make a transction to Data world through your course .,happy learning
"sir,in this course completion certificate will be there or not","Yes, once after you complete all the assignments and after successful evaluation, you'll get a course completion certificate."
"hello sir,
first of all, thank you so much for providing such content. I really want to buy this course could you please help me to go through this process.",Yes we will help you along the way throughout the course. For further queries please drop a mail at team@appliedaicourse.com.
"How can we get in touch with someone to get better understanding of the program and get career guidance for enrolling?
How many projects and case studies is included in the program and the duration to complete everything?",Please drop a mail regarding your query at team@appliedaicourse.com so that we can help you better
It will be helpful if we get search option by subject within the course videos.,"If you are referring to the comments, then we already have ""search"" option in the comments section."
"No, I am asking for the global search option within the course contents.",We will try to add global search option within the course contents.
Can you please provide optimized codes for the assignments as soon as you receive answer copies of assignments from students so that students can compare their codes with the optimized ones?,we will look into your suggestion
Video sound is too low. But its okay with other sites. Please check on that,Please use chrome extensions https://chrome.google.com/webstore/detail/volume-booster/ejkiikneibegknkgimmihdpcbcedgmpo
how long it would take to complete the course if I spend 3 to 4 hrs per day?,"Go to the schedule tab or link at website and fill the form, we will send you the schedule as per your investing hours"
I am looking for the data science. In that case do I need to complete entire course or only 1 and 2nd module. I as data science written in front of them. I please suggest,You have to complete the entire course.
"sir,i have completed and applied ml algorithms i got 96% accuracy in logistic regression but got only 26% accuracy when run the model in unseen datasets could explain?
i think due to overfitting and how to overcome it! could you resolve","Please mention the Train and CV scores. It is difficult to answer without context.
1. For Balanced Dataset: (Assuming your dataset is balanced)
i. If Train and CV accuracy are similar and the test accuracy is low then there may be some data leakage issue from CV to train due to which it is overfitting to the Train and Cv datasets.
ii. If Train and CV accuracy are dissimilar and the test accuracy is low then there may be some high variance issue, that is the model is overfitted to the Training dataset and no leakage issue."
SIr how can i Download the video lecture jupyter notebook?,"Yes, you can download the ipython notebooks. For those lectures in which we have discusssed the code part, just below the video player, you'll find a hyperlink to download the ipython notebook associated with that lecture."
"I love the way it was altered this course. but when i download the course syllabus 'DOWNLOAD SYLLABUS', the syllabus is still old structure of the course. If Possible, Please correct this. Thank you in advance.",Thank you for the feedback. We'll rectify it.
Hello Team.. Is there any lecture plan for Log analysis i have been trying to read online materials but not able to make a sense out of it.. it will be great to have Verma Sir shed some light on this topic so that we could head start in right direction.. Please consider this as my humble request.. :),Please drop us a mail at team@appliedaicourse.com regarding the same.
How does the placement assistance work for AAIC? I am in my third year and would like to enroll in the Machine Learning course.,As you finish your mandatory assignments in the course (within 1 year) we forward your resume to employers and help you to crack interviews by 2 mock interviews internally.
"Hi Sir,  Could you please help me to provide the Python code for Demand forecasting and Price optimisation project code in python.","No, we can't provide you the direct project code. You should be solving the problem by yourself, if you get stuck anywhere, we can help you out for that specific problem."
"i am interested in this course , would any assistance in job search be provided in usa or is it only restricted to india? i am currently located in usa on h1b","Please contact us at 91-8106-920-029.
You also can reach us at team@appliedaicourse.com and please do not forget to mention your contact number."
"Now that I have completed the Course and Got Certified awaiting my placements, I feel so proud of myself for joining this course, and let me tell you the concepts and depth you guys go to is just mesmerizing simply just the knowledge you guys have and the way you share it any newbie person go from zero to hero after this course. I have seen the course expand when I joined on Apr 2019 and till today, the contents the Live sessions have been so helpful, it seems finally being a CS student I am making some progress in actually learning what is the best use of a Machine is. Thank you guys for making such beautiful and elegant content. Nothing can beat AAIC in the coming years. I wish you guys grow to be the most successful training content makers there is.",Thank you for the feedback!
Iam unable to access my course assignments i used my login credentials to login into AAiC class room showing invalid.??,Please drop us the mail at team@appliedaicourse.com
sir what is this slack,refer this
Do we get lifetime access to the content?,No. It's valid for only 1 year.
I have 12 years of working experience in IT industry. I am looking for a AIML course in different institute. It seems this course is mostly for new joiners ...Will this course be useful to those folks who have 10+ software coding experience like me...,"Yes, definitely. we cover basic to advanced topics/SOTA like DenseNet, YOLO V3, etc. And provide Mentorship for the students to help them build a very strong Portfolio wrt your past career. please watch the video."
"Sir in which framework you teach this such as pytorch,tensorflow..Sir I also able to participate in kaggle competition after this course.",we typically use tensorflow and keras. yes you can participate
Hello Applied Ai team I have a dought that wheather this course has covered coding or only theory is there please inform,code which we encounter throughout the course has been explained
If i am unable to complete all assignments still can I sit for placement?,we need to complete all those assignments
"Hi,
The videos here are well ordered. But I'm lost when it comes to deciding which assignment is associated with which chapter. I cannot decide whether to go for the next assignment after completing a chapter here or whether the assignment requires me to complete some other chapter.
It would be better if in the assignment instructions in classroom, the chapters which need to be completed here are mentioned for each assignment",Why don't you cover each chapter one by one as each leacture at end explain what assignment to do. If you asking this query it means you haven't gone through videos well enough.
will u provide any degree certificate??,We will provide you course completion certificate.
duration and how many months will it take to cpmlete the course,"It depends upon your effort, but for some reference please use https://docs.google.com/forms/d/e/1FAIpQLSd0SZ_i3MwxVSASEj4J2Auv9LayLQOEtzglx4YV-TYTf8P0YQ/viewform"
"Sir, I am confused actually I passed BCA from Ignou in 2019. Initially,I am confused to do masters and looking for job whether my mind strike for applied ai course and do work hard and get job. Really Confused in the situation.... Help me out?",do checkout free videos and take a call. it will definately boost your career in datascience area
"Could you tell what do you mean by case studies, is it projects?","yes they are projects,for the real world problems you have to create ML model for solving those problems along with EDA, pre processing, tuning etc. You can check it module 6 for the same."
"Hey , are there any projects that we do in this course?","yes, there are case studies as real word problems that you will have to do, along with 2 self case studies."
i want to learn artificial intelligence in depth. but before diving deep into it i want to get a detailed  overview of it. can you suggest me a resource where it is explained in layman terms without getting into maths. hope i m nt being silly here.,"Well we have provided the overview of AI,deep learning,machine learning,data science. It's enough to have that much knowledge. I would suggest you get on to real stuff without worrying much about AI as special."
"Hello sir , i m currently working in mechanical fields from past 2 years.
I want to switch in IT field i am interested in data science in python.
Is it possible to get job for mechanical engineers.?? And if get then what will be the average package??
My mail id - tusharchavhan111196@gmail.com
Cell no.-7276274187",Please drop a mail at team@appliedaicourse.com for detailed enquiry. We will help you with your queries.
"Hello team,

In a neural network, when I was using relu as my activation function, the discriminant(the boundary) had sharp edges, but when i used tanh, it had smooth edges. what is the reason for it.(website: neural network playground: concentric circle dataset, task: classification)

Thank you in advance.",Relu takes lot of piecewise linear functions to fit as compared to tanh so this sharp edges. refer to 'Michael Lee' comment here
sir can i complete course with AMD A6-7310 APU with AMD Radeon R4 Graphics and 4.00 GB RAM ?,yes you can complete. for deep learning assignments you might need to use google colab
Please add Robotic process automation live sessions to give us an overview of RPA.,Thanks for the suggestion!
"Could you please add which modules are required for completing an assignment in the assignment. 
Helps in preparing better",Every topic in this course has an assignment and we recommend you to complete the video lectures of a topic first and then attempt the assignment associated with that topic. Please do not skip any video and follow all the videos as the order in which they appear on the website.
"Dear Team, Please try to  add below 3 sections in website:
1. View all pending videos
2. View All Questions Added by ME <By  Current User>
3. Book Mark Videos for Revision

Thanks.",Thanks for the suggestion!
"Hi,
Can i get some written notes of this course to revise the material.
or please provide me the book name relevant to this course.
my email id: karunrp2399@gmail.com

regards, 
karun",We provide the ipython notebooks as a part of the course. We recommend the students to prepare their own notes while going through the lectures itself and also we advise them to refer to the wikipedia and some books so that their command on the topics could become much more stronger.
"Hello team,

I was training a pre-trained bert. everybody is using optimizer while training the model. but the whole point of using a  pre-trained model is to use the weights which are already present in the model right? so, what is the use of using optimizer?

Thank you.",Well if you fine tune the pre trained model then optimozed can be of use
I am unable to see assignments in the course. First assignment should have shown in module 1 end of function.,All the assignments are present at classroom.appliedcourse.com
"In assignment 3 mandatory assignment 1Q, Ex:2 A*B is wrong multiplication....","No, it is correct."
You making more lengthy by adding those live classes to this course .,The live sessions are not included in course video-completion percentage. We have added them here it make more easily accessible.
"It is great to see the way the team of AppliedAI is supporting us during the quarantine. Thanks for providing the awesome live sessions along with the course contents.
But after adding all the live sessions, the course content has increase drastically.
Can you put them as optional and it should not affect the course progress?",They are optional. They are not added in the course video-completion percentage.
"for an interview ,
can I get different theoretical questions to list topics and their related video so that I can prepare it thoroughly.","After each chapter, we've complied many interview questions and have also attached the reference link/video for the answers."
can i get the video content after 1 year of this course?,The validity of the course is 1 year. For more details send an email to team@appliedaicourse.com
i dont have any IT backgrounf i have completed mechanical engineering...i would like to learn about data science and shift my field...how will this course hlp me,please do check free videos on youtube on this channel. this would be a good starting point if you want to learn data science and shift the field
"Hi team, please clarify my doubt whether the course contents are accessible by the students after 365 days of enrollment ?","For now, it is accessible for 365 days only."
"I'm very passionate about the AI/ML , and currently during my graduation in computer science  but i cant afford your fee for the course, can you recommend me any other alternative  way i should engage to endeavor  in AI/ML . 
can u recommend me futher some suggestions, as i  do all the work  myself without any guidance ?","1. We have an EMI option also. Reach us at team@appliedaicourse.com
2. We have some course content free to watch, you can start your journey of learning AI from this."
"Hello Sir, Good Morning, Hope you are good and safe!
Currently the appliedaicourse application timeout seems to be like 60  minutes, it will be good if the timeout is increased for ""one day"" so that we can avoid frequent session timeouts in a day. Thanks.","Hello, thanks for the suggestion."
"Can you add some feature to track our daily streak?
I'm not able to follow the schedule and do it daily, for me someday more and someday nothing.
How to get rid of this bad habit?",we will look into your suggestion. try to allocate a fix time daily to this course like morning 4-6 or midday12-2 or which ever time slot suits you
"Because of the COVID-19 effect, I am stuck to one remote location and their issue of internet speed. Are there any possibilities to download the live sessions on PC for offline viewing.","No, there is no such option."
"Hi,
I have 2.7 years of experience in Python including about a year of ML. It has been 1 week since I enrolled in the course. I really like Srikanth sir's in-depth explanation of every concept and also the dedicated team support for query resolution. You don't let us feel alone in the dark if at all first stage googling doesn't help :)
Also, I would like to request some feature additions to enable a smoother user experience.
1. Please add some activity log in our dashboard or a notification widget which helps us keep a track of the comments we put and upvote. It would be helpful for revisions.
2. When a submitted comment is being answered by the team, you can assign a question type category like 'Addon to the video content' or ' Code error related' or 'Feedback', etc. So that, later on, we can easily filter comments by the question category of our own choice.
3. It would be great if a bookmark option is provided in the video player where we can bookmark the particular moments of important topics in the video according to our own grasping powers. 

Thank you!",Thank you for the feedback! We'll include that in our next iteration of updates.
"sir,can u plz upload the video of how to submit assignment from with code example",Please watch https://www.youtube.com/watch?v=fYWscpmArq0&feature=youtu.be
What is the difference between validation_split and test data.,Validatadation dataset is used for tuning the hyperparameter in the model and the test dataset is used to report the performance of the trained model on the unseen data.
"I am a new student in the classroom , so how to join the slack?",Send an email to team@appliedaicourse.com
"In the Deep Learning part, will we be working with tensorflow2 or tensorflow1?",We are using tensorflow 1.0.
Hey! team..i am unable to enter my aaic classroom. invalid authentication is being shown. why??,Please drop us a mail at team@appliedaicourse.com along with the screenshot.
"Hello team,
What I am learning here and solving assignment s is a basic to land in ml or it will be totally different while working in industries. As machine learning engineer in industries I will work in jupyter notebook? What I am learning in case studies same process I work in industry to solve ml problem?",it is a basic to land in ml
"Hi,
Do we need to complete all the assignments for getting the certificate .","Yes, you've to complete all mandatory assignments."
Can do deep learning directly without machine learning ? i am familiar with python programming and i have finished the first 2 modules.,"without the knowledge  of classical ML, you will not be able to understand the Deep Learning concepts because 90% of the DL is based on the classical ML itself. Hence we recommend you to follow the order in which you see the lectures in the website."
"Hi Team,

I am currently in my final year of Engineering (ECE). I wanted to make my career in data science, so please tell me if this course would be a great fit and what are the chances of getting placed ?",Please call us at 6301-939-583 (or) 8106-920-029. We'll clarify all your doubts.
"Hi, thanks for the course material. A question: Is there an overlap between Free Videos and Curriculum? Are the videos in 'free video' not present in the curriculum? If so then I will finish both the sections separately.",Free videos are there in course curriculum.
Today I have finished One year and completed the Course. You have been a wonderful Teacher. Your explanation and motivation has been Superb. Hats off to you to make this Field interesting. Thanks for all your support and timely help on all complex and sometimes stupid Queries. Keep up the Good work. Cheers !!!,All the best for your bright future Dipak!
"Hello Team, If possible add a live monthly Demo night/morning sessions, where registered candidates will have to display their capstone project. The capstone project should not be the one from listed assignments. I think this may prove to be quite useful for everyone.",we will look into your suggestion
"Hi Team, Is it necessary to have  as system configuration of 8 GB ram for pursuing the course, I have python installed on my company laptop , what are the other software necessary for the course.",Please drop a mail regarding your query at team@appliedaicourse.com so that we can help you better.
Where do I find all the live sessions recorded videos,Please visit this link https://www.appliedaicourse.com/live
Can you provide the website in DARK MODE?,Kindly drop an email to the team at respective given mail id.
are  all case studies are  been explained in detail,Yes. Everything from data collection to inference. Each stage is covered perfectly.
wow!! U added that feature .I am happy and surprised :) Keep going.May we both succeed !,Glad to hear!
"love the new website update, please do work on an aaic app too?",We'll look into this request .
