question,answer
I have seen RPA is much booming nowadays. How is RPA different from Machine Learning? Which one is advantage and which one is good in terms of Career? Kinldy provide more information on this.,"RPA is a fast evolving field with a good number of openings nowadays. But, RPA is limited in its scope of what is automatable using specific tools. ML, on the other hand, is more generic and it can do everything that an RPA tool can do and much more. Hence, the opportunities for ML are a lot more across many industries and across a wide spectrum of problems. To be clear, RPA is easier to learn and pick up as compared to ML. While ML is a more foundational skill, RPA is mostly a functional tool.  

The choice boils down to how much effort you can put in. If you are willing to put in more effort and learn a foundational skill, ML is the way to go. If you want to quickly learn a new and cool tool and ride the wave of opportunities, RPA is a way to go."
"Sir, my system config. is 4 gb ram and i3 processor... is this good for the course ... if not will using google colab will work??",We would recommend 8GB Ram system for successful completion of the course. Google colab will not work efficiently as it has session limit.
"I want to learn about Named Entity Recognition(NER). Please suggest some links with code samples.

Thanks,
Mehul","please go through these blogs - blog1, blog2, blog3"
I'm a management student in business analytics.I don't have much programming skills.Is this relevant for people who want to start their career as data analyst/business analyst? Are there people from this domain who enrolled in this course?,Please feel free to call us at +91 8106-920-029 or +91 6301-939-583 so that one of us can better understand your background and we can have a detailed discussion with you on this.
hello sir this is divyam raj i was looking for a data science course is this course helpful?,"Yes. Irrespective of the educational background, we are able to place many students in ML Engineer/Data Scientist positions. For detailed discussion, please call us at 91-8106-920-029(Within India) or mail us at team@appliedaicourse.com"
"Hello Sir, I was going through your tutorials of Exploratory Data Analysis. Can you please tell me where bin_edges and count in CDF are explained?.","I would say that you complete the videos serially and don't skip in between but if you are still interested then start watching from 
https://www.appliedaicourse.com/course/applied-ai-course-online/lessons/histogram-and-introduction-to-pdfprobability-density-function-1/"
Can u also include Forecasting,We already have case studies 'Taxi Demand Prediction' on time series forecasting problem. Please go through that.
I am 29 years old. I had completed Bsc. IT and  Working as an executive since last 4 years. Would you please suggest me that should this course is useful for me. If I want to make my career in machine learning. Is it possible for me to change my current profile to machine learning. Please guide me.,Please feel free to call us at +91 8106-920-029 or +91 6301-939-583 so that one of us can better understand your background and we can have a detailed discussion with you on this.
"Hello sir
Please can you explain the attention and self attention in your videos.",The concept of Attention is simple if you understand what it does. It basically takes the output from all the time steps in the encoder and append it and pass it in the decoder section in something called Context Vector so that the decoder can see which encode the state of LSTM was important to decode.
"Thanks for replying. 
I have confusion in self attention, what does keys query and value mean and  what would be the dimension of these?
I want to understand QA-net that basically uses self attention please help.",Drop us an email at team@appliedaicourse.com and we shall help you out.
"Hello , 
I am btech(IT) graduate and it's been 6 months i started working as a Quality engineer in a software company , my concern is that i have my 12th score is less than 60% , but above 70% in btech and 10th would my 12th percentage become any kind of a pebble here in job scenario 
Please reply in this context",Please feel free to call us at +91 8106-920-029 or +91 6301-939-583 so that one of us can better understand your background and we can have a detailed discussion with you on this.
Is this course recommended for students directly after High School. It it equivalent to the professional degrees for career building? Happy to discuss over phone call.,"Yeah sure, Please feel free to call us at +91 8106-920-029 or +91 6301-939-583 so that one of us can have a detailed discussion with you on this."
Can you also add excel tutorial like you have add for MySQL.,"Sorry, currently we are not having any plans of adding those lectures on excel."
"Hii team@appliedaicourse.com,
I'm running three days behind which I having trouble following the schedule, that is impacting on my study. I'm not properly following the schedule that you created.
Please help me sir","you need to be very hard on the schedule, if you are lagging on a few days, you can spend more time on weekends and align with the schedule."
i have not done any good project in my Btech final year.But i am applying for pgee i.e entrance exam for iiit hyderabad. In the application form they are asking for my project details. so in what way this course is helping me to do the project within two months of time.And i have no idea about machine learning projects. is there any project included in this course ?,"Case studies, comprising of problems from various domains are part of the course.
regarding ability to complete the course in two months, this will depends on learning potential and the number of hours one can spare daily."
"My system configuration is i5(5th gen), 8 Gb RAM and 4 GB Nvidea Graphic card(920M).
Can you please tell me is it good for this course?","Yes, you can go ahead with this :-)"
Plz give me total ipynb pdf drive link,"We have structured the course such that whenever a concept is being covered, link for the ipython notebook(wherever there is a code explanation) is provided in the same page."
"Hi,

I have basic question
What is the difference between  AI, ML, and Data science ??",check this out: https://www.youtube.com/watch?v=QizsAE4fBpQ
sir how many months it would take to complete the course and what should be the prerequisite for the course?,6 months and pre-requisite is basic mathematics understanding. Everything will be taught end to end.
what if someone is weak in mathematics from the basic then should he enrolled to this course,Dont worry. All the mathematics required will be covered as part of the course in simple and easy to understand terms.
"Hi. I would like to know what system requirements we require to follow the course assignments and lectures. Is it possible to run the assignments or any given code in Google Colab or Kaggle Kernels, as they provide free GPU(also TPU in Colab case). I am really interested in joining the course and would like to know clear recommended specifications that our machine should possess. Apologies if the question is repeated.","Any laptop with the below configurations is fine.
System requirements: 8G -16G RAM, with i7 processor, 4G graphics card from NVIDIA(if you want to run deep learning programs which is optional, generally 1050Ti and above is preferable).
You can use Google Colab for deep learning problems as well."
Could you further clarify about which i7 processor variant to choose exactly? If it's no trouble. Because the other specifications are easy to choose. Thanks,"Anything can be fine:
https://ark.intel.com/content/www/us/en/ark/products/series/122593/8th-generation-intel-core-i7-processors.html"
"I did ML course in coursera previously, Now i decided to do applied Ai course.My current qualifications is Diploma(cse) . Just suppose i have done with  all the casestudies nd submit all assinments. Can i get an internship in ML or data science role in industry after completing this course?","Yes, we do help you with both internships and full-time roles as you progress through and complete the course. Please call us +91 8106-920-029 or +91 6301-939-583 to know more details."
"Hello Team,

I am Kunal Singh, from Bangalore. I have worked as a data analyst in a company for the tenure of 2.2 years. I belong form the Commerce stream as i have completed my BBM. But i do have a good knowledge of Excel and MS products coz i was used to  it in my profession. As i had worked in IT company i wish to phosphor in this domain.

I am Afraid of not having any Technical educational background like B.tech or CS. As i have done some of the research and Investigation i came to know the Programming languages like C,C++ and Java are important skills to learn ML and AI. I have engaged myself on learning these stuffs as of now. 

As per my above concern, would be i able to Join AAIC and learn AI and ML. I can See all the other friends here belongs from the technical background :( :( :(. 

I am keen to Learn.

Please suggest me.",Please feel free to call us at +91 8106-920-029 or +91 6301-939-583 and we can explain to you how students who have no coding background could still land a job at the end of the course.
"Hi Team,

The Live sessions are they going to be recorded and saved somewhere?

Regards,
Sandeep","yes, but we strongly encourage our students to attend live sessions so that it becomes a regular habit. Our registered students would be able to access older live sessions after a significant delay and not immediately after the session.?"
"since your course offer jobs .. so what is range of salary to the fresher , who completed your course with your assignment with your given time duration",Kindly give us a call on 91-6301-939-583 (or) 91-8106-920-029 to have further and detailed discussion on it.
"Hi Team,

Are there any practice questions available for the initial lectures up to 4.11?","You can check in our classroom, we have some assignments regarding python."
i did not get any email about joining google classroom,"We have sent an email with all the guidelines, if you still didn't get please drop an email at team@appliedaicourse.com"
"Hi,

I works at a MNC as Java Developer.I am a Bsc graduate in Mathematics.Can I go for this course? If yes, then how will be my IT carrer here after?
am i able to manage all this because as i said  I am an full time employee in a MNC? 
I will begreatful if you let me know the process and all.
Thank you.",Please feel free to call us at +91 8106-920-029 or +91 6301-939-583 so that one of us can better understand your background and we can have a detailed discussion with you on this.
"Hi, I am a 2016 batch passout in production engineering student with 6 months of experience in manufacturing sector but now I feel like switching my profile to Machine learning. So, would this course be beneficial to me as I have Non IT background with almost 2 years of gap after B Tech. Please help me out..",Please feel free to call us at +91 8106-920-029 or +91 6301-939-583 so that one of us can better understand your background and we can have a detailed discussion with you on this.
Can you please add one more complete  module on timeseries,"Time series analysis is a statistical technique that deals with time series data, or trend analysis. Basically, Time series data means that data is in a series of particular time periods or intervals. Time series are analyzed in order to understand the underlying structure and function that produce the observations. 
We also solve case study ""taxi demand prediction"" based on time series data.
We cover a lecture on how to generate features from time series data starting from:
https://www.appliedaicourse.com/course/applied-ai-course-online/lessons/moving-window-for-time-series-data/"
"Hi Team,
 As i have completed by b.tech in 2016 and i have got job opportunity in 2018 working as full stack developer  and i want to move to AI , how can this course helpful to me as a employee after working hours i have less time to cover this course . And i want to know is there will be any problem for me while attending interviews after completing this course where i have a gap after my graduation.",Please feel free to call us at +91 8106-920-029 or +91 6301-939-583 so that one of us can better understand your background and we can have a detailed discussion with you on this.
"I am considering going into DS/ML/AI and this course seems to fulfill most of the requirements. Sir, can you please confirm the fee / payment structure? On the website it say one year validity for $25K. Will I have access to video/lectures after one year. I would like to have continued access to material to come back for revisions. Let me know please, I really like the course and would like to enroll.",Please call us at +91 8106-920-029 or +91 6301-939-583 so that we can better answer your question more accurately.
"Hello Team,

How many assignments are included totally in this course? (including case study assignments)","Thirty assignments, as of now. We constantly change these 30 assignments on regular basis."
"Sir,
I have heard that Statistics is one of the most important, if not THE most important, part of Data Science. So, does it make sense to first get a solid understanding of the core concepts of Statistics before starting with the course?? That way maybe one can get even more purchase from the lectures. Or will the lectures under the ""Probability And Statistics"" section of the course suffice for understanding the Statistics portion of the Data Science???",We cover all of the core and foundational concepts needed for Data science on the Probability and Statistics chapter.
What is the eligibility for the job guarantee which you provide?,Please call us on +91 8106-920-029  or  +91 6301-939-583 to know more.
"okay sir, one more query to ask, is this machine learning course complete or you will be adding more content to it?","The course is never complete as we constantly add, edit and remove topics based on industry needs and students feedback. We have changed a very significant amount of of the course in the last 3 months. It is a very dynamic course"
"What is the difference between tensorflow and tensorflow 2.0?
Which part of this course will get affected by tensorflow 2.0?",tensorflow2.0 is yet to be released and there are going to some changes: https://medium.com/tensorflow/whats-coming-in-tensorflow-2-0-d3663832e9b8. Most of the deep learning modules are covered in keras so it should not be too much of a worry.
"Hi ,
It will be great if you can provide a keyboard shortcut to directly move to next video :) .
Thanks,
Pankaj",Sure. Will add it as a requirement for the next update of our website. Thank you for your suggestion.
"Hi Team,
Could you pls tell me if I am working on Insurance Fraud Claim.If it is being told that Random forest is among the best algorithm,
then why not to apply it directly on the Insurance dataset,instead of trying any others(Since RF is well tested algorithm)? 
Pls clarify in real world scenario.
Secondly,What is SMOTE?How to apply?

Thanks","1. Why not use GBDT or SVM or another method? Why RandomForest? It is best to choose the best-performing algorithm that also satisfies other business and real-world constraints like latency, interpretability, cost of training and evaluation, availability of probabilistic class labels etc.

It is best to try out various methods which satisfy the real-world constraints and pick the one that actually performs best. It is best to avoid any favorites. If the data shows that RF is the best method for your task, then you should certainly go with it. 

2. SMOTE is a method to generate synthetic and new data-points using k-NN especially when we want to tackle the class-imbalance problem through upsampling.
Refer:https://en.wikipedia.org/wiki/Oversampling_and_undersampling_in_data_analysis#SMOTE"
After successfully completing the course.Am I able to create a chatbot?,"Yes, you will be able to build a chatbot by the end of this course."
"Hi Team,
What is the difference between Regularized Logistic regression and linear svm?
Thanks","Both objectives have the same components: the loss function and the L2 penalty. It is also true that these two models often give very similar performance. 
However there is fundamental difference: Logistic Regression outputs probabilities and SVM maximizes the margin. The point of SVMs is that is ignores all but the close points (support vectors) in the loss. In that sense it ""maximizes margin"" quite explicitly in a way that logistic regression does not."
"Hi Team, i see there is not a lot of NLP related content in the course. Can you suggest a few links with good content for NLP?","This course consists of many of the important concepts from NLP ranging from simpler concepts like Bag-of-words to state of the art RNNs for NLP. We have introduced these concepts as the course progresses. We also have many case-studies which focus on NLP applications like quora-question pair similarity, Stackoverflow tagging, Personalized cancer diagnosis etc.
audio reply: https://soundcloud.com/applied-ai-course/nlp-in-the-course-1

Links: https://blog.algorithmia.com/introduction-natural-language-processing-nlp/
https://www.analyticsvidhya.com/blog/2017/01/ultimate-guide-to-understand-implement-natural-language-processing-codes-in-python/"
"i am curently in second year  of  engineering, my cgpa is low(around 6 cgpa) , even if i cover this course with good grades , will i get offer from top notch companies. will cgpa affect my career in anyways?",Please call us at +91 8106-920-029 or +91 6301-939-583 so that one of us can better understand your background and we can have a detailed discussion with you on this.
"Hi Team,
I am from a testing background but i know coding basics as i have worked on selenium with Java. I am having total 7yrs of experience in IT as a tester, but i really want to move to data science or AI. I want to change my career path , will it be ok for me to move to AI or Data science. After completing this course what will be the career prospect will i be a treated as a fresher in market. Please suggest.",Please reach out to us at +91 8106-920-029  or  +91 6301-939-583 so that we can have a detailed discussion with you on this.
"Hi,
how do we get requirement in which form in real world as it may be from multiple source and how do we make ready to use single format e.g. csv?
How do we present our result to client?
Thanks","1. Just like any project, you talk to all the stakeholders to understand the project requirements in detail and document them clearly.
2. Databases, Data-warehouses, CSV, text-files etc.
3. Mostly through plots and detailed writeup of the findings."
"Hi Team,
Why GBDT provides better performance 
and accuracy than bagging(RANDOM FOREST)?
Pls elaborate.

Thanks",GBDT does not always give better performance than random forest. but many times we will get better performance because it trains tree based on errors of before tree. random forest makes many trees with random sample data and gives the majority vote.
"Why we are taking F0(x)=L(Yi-gamma) instead of F0(x)=L(Yi-Ypred) as error should be initially Yi-Ypred to start with,Rather that not being (Yi -gamma) in GBDT or XGBOOST?
Pls clarify in detail,as I am totally confused.

Thanks","gamma in base model F0 indicated predictions values only. don't confuse with learning rate gamma, that is different."
"But as in wikipedia,

F0(x)= argmin_gamma SUM_1ton{ L(Yi,gamma) }

Here, as written above gamma is a part/term of complete  eqn. of F0(x).
So,how ""gamma in base model F0 indicated predictions values only""?
Pls clear me as always :)

Thanks",please check in this video.
"And one more query, I want to ask is about the case studies - some times when we understand the concept and cannot work on case study but need some more understanding of the question being asked or sometime hints, then can we contact you for the same?","We mentor you through the case studies that you would work on.  More importantly, you would have seen many case-studies in the course itself and hence you would be able to take our hints and proceed. Of course, you would have to put in a reasonable and non-trivial amount of effort from your end also."
"Hi Team,

I went through some of the free available videos. And I could see that you are explaining the concepts in a fairly easy manner but my concern is about the code. I could listen the faculty saying that we can download the code using notebooks but what is the meaning of each line of code? Which function is doing what? What else can we write to accomplish that same thing?

As I am from programming background, I know that we can accomplish one task with many different ways, that is why, I am a bit confused and curious to know the answer to this please.

Where can we get the answers to these queries? It would be great, if you can help me getting answers to these queries.

Thanks,
Gurmeet Kaur","Gurmeet, we explain the basics of Python in the very first chapter. We also explain each of the key functions in detail as and when we progress through the course. But, as we progress through the code, we may not go line by line as we have seen similar code earlier. If you do not understand any segment of code, feel free to put it in the comments section under the video. We would respond with a clarification. It is impossible to cover all the ways to achieve the same task as there are sometimes tens of ways to do the same using different functions and libraries. We try and provide one of the more commonly used and efficient ways. Additionally, we want our students to have the ability to navigate through ML code comfortably by the end of the course. Hence, we avoid going over code line by line in the later chapters of the course as similar concepts have been covered in earlier chapters. If there is some new concept, we would surely go over it in detail. We want our students to put in the effort to understand the code on their own especially in later chapters as they would have to do it in their jobs once they complete the course. If there is any blocker, we are always here to help.

Please call us on +91 8106-920-029  or  +91 6301-939-583 to learn more about this."
"HI ,
How much percentage case study weight in applied ai course ?

Thanks ,
Pankaj",Close to 40% of the content and 50% of the assignments are from case-studies.
sir i am btech 6th semester(3rd year)  cse student after completing this course will your team help me in getting an ai based job or an internship in my 4th year.,"Yes, we do help you with both internships and full-time roles as you progress through and complete the course. Please call us +91 8106-920-029 or +91 6301-939-583 to know more details."
"Hi Team,
Suppose I have created a model in Jupyter notebook.How do we deploy to the production enviroment in real time?",you can create an API and deploy.
"Hi,
Could you pls elaborate how to create api?Pls tell me the code and steps ?
Thanks",You can check in our video.
Hi. I would like to know what system requirements we require to follow the course assignments and lectures. What if I had a laptop with i3 processor and 8 Gb Ram,"Minimum Recommended PC Specifications:
RAM: 8GB or above
Processor: i5 or above

You also can use online platforms like GCP, AWS, etc for assignments."
What stipend / package can I expect under the job guarantee program as an intern or a fresher for the data science role earned with your assistance?,Please call us at +91 8106-920-029 or +91 6301-939-583 so that we understand your current role and better answer your question more accurately.
"Hi Applied AI,
Course Content looks really interesting with most of the topics covered. I would love to apply for this course . I need some some information from your side.
 I have around 9 years of Backend programming background. With good command on SQL. Working Knowledge of spark and python. Currently I am working in Data science team (as Backend developer.). ALso I have around 3 years of Finance domain knowledge and keen interest in Risk Management and Portfolio Management. 
Given my background can this course help me in progressing my career in Machine Learning?",Please call us at +91 8106-920-029 or +91 6301-939-583 so that we understand your current role and better answer your question more accurately.
"Sir, @Srikanth & team, I have gone through all the Success stories & just a visual pattern, Almost 80% of the hired ones are Freshers, & the rest have Software development experience, What about people from IT whom don't have Software development or coding experience ?.. How does AppliedAIcourse make sure that hiring is guaranteed for such a candidate ?..",Please call us at +91 8106-920-029  or  +91 6301-939-583 and we can explain to you how students who have no coding background could still land a job at the end of the course.
