question,answer
"Hi Sir,
iris = datasets.load_iris()
x = iris['data']
y = iris['target']
tsne = TSNE(n_components=2, perplexity=30, learning_rate=200)

X_embedding = tsne.fit_transform(x)
# if x is a sparse matrix you need to pass it as X_embedding = tsne.fit_transform(x.toarray()) , .toarray() will convert the sparse matrix into dense matrix

for_tsne = np.hstack((X_embedding, y.reshape(-1,1)))
for_tsne_df = pd.DataFrame(data=for_tsne, columns=['Dimension_x','Dimension_y','Score'])
colors = {0:'red', 1:'blue', 2:'green'}
plt.scatter(for_tsne_df['Dimension_x'], for_tsne_df['Dimension_y'], c=for_tsne_df['Score'].apply(lambda x: colors[x]))
plt.show()

how to add legends in this code.

Thanks and regards 
Deelip Kumar","Please try this-

seaborn.FacetGrid(for_tsne, hue = ""target"", size = 10).map(plt.scatter, ""Dimension_x"",""Dimension_y"",""Score"").add_legend()."
"Hi sir,

for_tsne_df = pd.DataFrame(data=for_tsne, columns=['Dimension_x','Dimension_y','Score'])
colors = {0:'red', 1:'blue', 2:'green'}
plt.scatter(for_tsne_df['Dimension_x'], for_tsne_df['Dimension_y'], c=for_tsne_df['Score'].apply(lambda x: colors[x]))
how can i add legend in the above code.

Thanks 
Deelip Kumar",Try adding plt.legend() at the end.
"Hiii 
     I am working as tech support and I want to do job on ML . If I will join the course and go for interview via  applied ai reference  then my tech support experience matter? And can I get job as ML engg after doing tech support job.","Yes, you can get a job as ML engg. Please call us on +91 8106-920-029 for more details."
Do you provide full course at a time.  i mean can i make it within 4 months instead of 6.,"Yes, as soon as you register for the course, you will have access to all the code videos and assignment."
"Earlier I used to see Assignment-2: Apply t-SNE under module - 3, But now I could not see this assignment, is it removed?",The assignment videos are there in instruction part of respective assignments in classrooms.
Does  College CGPA affects Job garuntee provided by the course??,"No, it does not."
If  I enroll for course then I  will get certificate or if we didnot enroll and completed the course will I get certificate,"Certificate will be given to enrolled students when they finish the course. Moreover, not all videos are available if you are not enrolled. Please contact us for futher information."
"Hi 
Can I whether I can get the certificate after completing the Course",Yes you will get a course completion certificate from AppliedAI after you finish 30 assignments.
Is a 6gb RAM and an i3 processor enough to complete the course?,"Well, you can perform some basic assignments with this config. For assignments that are computationally expensive, you can use google colab or Google cloud for free. We will be guiding you in using them for your assignments."
Can I practise ML on ubuntu or is it better to have windows 10?,You can use either of the Operating Systems.
this is not for free course,"Yes, it is not a free course. But, you can watch some free preview videos."
"Hello sir,
I came across a term known as empirical risk minimizer. Can you please explain it to me in simple English?

Thank you sir.","Suppose you have a dataset Z coming from unknown distribution then when we predict the values from the distribution we must have error of prediction as much low as possible.

Empirical risk = E[1/n * sigma Loss(yi^ , yi)] where yi^ is predicted values
where E denots the expected value"
"Hi Team,

My Account was expired. How can i get the access for the python notes. Please let me know.",Please dorp us a mail at team@appliedaicourse.com
"Hi Team,
my name is sawan gupta. I have completed my be in computer science in 2012. but due to not some kind of reason i did not get job in software industries and right now i am working in BPO sector.
So if i joined these course so is there any possibilities  to get a job because it's 7 year to go to complete my graduation and right now i have no knowledge of programming.",Please call us on +91 8106-920-029
"Hello sir,

I really need deep learning right now for my assignment in college. Can you please which all videos do i need to watch before jumping into deep learning (i don't have time to watch all the videos up to module 7). can you please tell me the important videos(i.e., which are prerequisite for deep learning until module 7). so that I can directly jump to module 8.

sorry for this sir
Thank you.",You can watch up to SVMs and then watch deep learning videos.
I learnt about this course from a friend and was really impressed after going through some of the videos. Does the job guarantee program also apply to international students i.e non Indians and those not residing in india?,The job guarantee program is for students from India and USA only.
"please add subtitle for all the video, sometimes cannot heard correctly",Thank you for the suggestion. We will let you know once it is done.
"Hello sir,

In the ridge regression model,  the equation has two parts,   a+lamda(b), where a is the sum of squared errors and b is regularization term. how can we show that as lambda increases, 'a' increases?

Thank you, sir.",Please go through this video.
"Hello sir,

can we prove it mathematically? if yes, can you please explain it?

Thank you sir.","squared loss is (y−y^)2=(y−(W.x+b))2(y−y^)2=(y−(W.x+b))2(y-\hat y)^2 = (y - (W.x+b))^2 and regularization = λ.||W||λ.||W||\lambda.||W||. Now Our aim is to decrease the ( Loss + reg ) so i have the decrease the regularization term as well. Now, If my λλ\lambda increases, my regularization term(λ.||W||λ.||W||\lambda.||W||) will increase but I am trying to decrease the regularization term so ||W||||W||||W|| must decreases while optimization because of the increase in the  λλ\lambda. 
If  ||W||||W||||W|| is decreasing, y^y^\hat y will decrease and squared loss will increase. Another important point is the threshold of  λλ\lambda totally depends on data we have."
"Hi team, as a suggestion, if you could add a Course progress monitoring section for each account like a simple line graph of minutes of content watched each day/ percentage of course completed in one-day on the y-axis and the dates on x-axis, it'd be very much helpful to us, like we'll be able to see if we're maintaining a constant progress or do we need to put in more effort. 

Also, if you could return the grade/marks obtained in each assignment, it'd be more useful than rather just accepted or rejected.
Thank you :)",Thanks for the suggestion! We will let you know once we add such a feature.
Could we get zip extracted folder having all the Jupyter notebooks according the AAIC syllabus contents? It will be very much helpful to refer them easily without  downloading each and every time.,Please send an email to team@appliedaicourse.com
"Hi team,
Is this course syllabus covers all data science Topics",It is difficult for any course to cover all data science topics. We have covered the most useful topics.
"Hi team,
i3 processor,3GB ram and 87.8 hard disk size.....is it sufficient to complete the course?","No, you might find some difficulty in running some assignments. You can use google colab. It's free and offers GPU with 12 gb of ram."
"The course content is very good but I would like to highlight one issue faced by the aspirants enrolled with this course.
The assignments in this course are based on very large dataset because of which it takes frustratingly large time to run and sometimes system also fails due to memory limitation. GCP also does not seem to be very useful.
Ur content is very classy, so if you re-design the assignment and make it a bit aspirant friendly, it would encourage aspirants.",As per our experience here students have not faced much such issue with i5 and 8-12 gb ram is sufficient.
Are you planning to release mobile apps to access the content. It will be an awesome experience with a feature to see videos in offline mode (while commuting etc),Thank you for your feedback. We'll take it into consideration.
is the oops concepts also covered in module 1 for python programming?,No. OOPs are not covered in this course. Please refer this for oops.
is oops concepts to be covered by myself if I opt for this course? I mean is it necessary to know oops concepts,"No, they are not necessary for this course. But it is always better to have a basic understanding of those concepts."
"hello Team,
I live in Hyderabad only. can I go to your office directly instead of talking on phone as i have many queries to discuss.","Yes, you can."
Does paying in emi will let use the full content for that month,Yes you can use full course
Sir course completion percentage is showing wrong? As I have completed some contents and given a completed tick mark.,"The revision questions, interview questions and assignment sections also contribute to the percentage of the course completed. Please check it once."
Wanted to join this course! just have some doubts.  What is the duration of the course..??  what if I directly completes assignments by skipping some chapter.,Please call us at +91 8106-920-029 or +91 6301-939-583 so that we can help you out better
"sir, one thing I would like to ask. To implement these functions it would take long hours to compute output. Please , although silly the doubt is, if you would mention the specification (minimum) to run the algorithm smoothly for a learning point of view keeping in mind the image data set and NLP also with deep learning implementation. On quora etc I read the answers and all pointed towards all those heavy gaming laptops with very high prices.",You can go for i5 procesor with atleast 12GB ram with 1/2 Gb gpu.Thats enough I guess
Can you please add 'search' feature  so that we can search the topics which we need to watch for revising.,Thank you for the suggestion. We'll look into it.
Please add remember me checkbox.,Thanks for the suggestion! We will try to add it soon.
"Will I get a  related certificate from your side  ,after  I successfully completed this course ?","Yes, you will get a certificate upon course completion."
Please add a search option so that we can search for a specific topic,We'll look into it.
"I m experience in electrical and planning feild in Thermal power plant. Is therr any scope here 
I wannted to be a data scientist.
Is this ML will help me",Please call us on +91 8106-920-029
"If I buy this course, will I get lifetime access or access period is limited?",The validity of the course is 365 days.
May I know what is the reason for having a limited time period for this course?,"The reason for having a specific time period is to create seriousness and punctuality among the students and make them finish the course and learn the concepts thoroughly within a specified time.  If there is no specific time period, it might take years and still most of the students will not be completing the course due to lack of seriousness. Also the stuents might gets distracted from the course if they have infinite amount of time. Hence we have specified the validity period as 1 year keeping not only the college students, but also the working professionals in the mind. One year period is a sufficient amount of time for a new bie to start from the scratch and finish the course along with advanced case studies."
Is there us certificate for free videos,You'll get a certificate of completion only if you register for the course and finish all the assignments.
Which is better place to stay for machine learning interview? Bangalore or Delhi?,You have got many companies in Bangalore that hire for ML Engineer/Data Scientist positions when compared to Delhi.
"Hi, I am from manufacturing industry backround with domain experience in materials of around 7 years. Currently I am learning Python programming. My basic qualification is BSC in Chemistry.Please let me know whether I am eligible to learn Machine Learning and chances of getting Job after completion course due to my Non IT background.",Please call us on +91 8106-920-029
is it possible to land a ML job without knowledge in datastructures and algorithms?,"Well, if you are looking for a job in big league companies like Google , Microsoft you need to have a very good knowledge of data structures and algorithms. For other job roles, basic knowledge of data structures and algorithms is good enough."
Iam passedout in2015 year btech  I have an gape no experience is there suitable or not plus conform me,Please give us a call on +91 8106-920-029 or +91 6301-939-583 so that we can better understand your branch and background  and let you know whether its suitable for you or not.
"Hi Team,

How to get access to Dekstop app to attend live session?",Kindly email us the same and we'll resolve your query.
I have a question that how much percentage of ML and DL consist of Natural Language Processing part?,We have covered all the basic tools of NLP required kindly visit the NLP videos for it
"Hi,

There is total 9 chapter in this course. As per google classroom we should start with Assignment-1 which is ""Data visualization"". Bt as per course curriculum SQL is their in Ch-1. - Assigment 22. 

So my question is can we proceed with 1-2-3 and do i need to do SQL assigment first?

Please reply..",You can follow as per the Google Classroom assignment numbers. You can skip the SQL for now.
"hello team,

                    Please include the content for computer vision also in the course and also I have observed that the assignment are not in the sorted order they are randomly placed in the course and also try to include the lastest syllabus for ML as well as AI","Thanks for your review Durgesh !
We are currently working on it and soon update the content."
"what happens when your one year validity is over, we can still have access to course right? only thing is we cannot submit assignments",No. The full access will be lost. You cannot submit the assignments and also you cannot view the video lectures.
"Hi Team, 
Would this course also  cover the contents necessary in the field of Data Science. Also is Machine Learning and Data  Science interrelated? And can we look for an opportunity both in the filed of as Machine Learning Engineer and Data Scientist after successful completion of this course?
Many Thanks.",Please call us at +91 8106-920-029 or +91 6301-939-583 so that we can assist you better.
How long is the course  valid per payment?,The total validity of the course is 365 days/1 year from the date of registration and the course should be completed within this period. For more queries please drop an email to team@appliedaicourse.com.
"Sir, I just want to know is there required any degree and what's the procedure for apply?",Please reach out to us  to have a discussion at 91-8106-920-029(Within India) or mail us at team@appliedaicourse.com
"in numpy if we want to extract value which is less than some value from 1st coloumn then how to do it
ex
data=array([3,  1, 6
             4, 3, 7 
             1, 2 3 ])
i want data<4 from first coloumn","Let a = np.array([2,4,6,8,10])
For example if you want all the values greater than 5 in a given list, then 
1) If you want to get the result in the form of a list, then
b = [x for x in a if x>5]

2) If you want to get the result in the form of an array, then 
c = np.array([x for x in a if x>5])"
Can we add this certificate in LinkedIn?,Yes you can do it.
"Since the course content is huge and candidates' requirements may vary, it would be helpful, I think for many students, if a road-map could be provided detailing the dependencies between the modules. For example, can I complete module 8 without completing module 5...",We actually insist the students to follow the videos in the order they are present. The modules are dependent on previous modules.
"Best YouTube channel for learning machine learning
https://technoidhub.com/technology/best-youtube-channel-for-learning-machine-learning-and-artificial-intelligence/16247/",Thanks for sharing!
any plan to add GANs in the course ??,"Yes, we will try to introduce some of these new topics to the course in the future."
"Hi , I have queries which I need to talk to some representative . Is it possible to schedule it on this weekends",Please drop us a mail regarding your query at team@appliedaicourse.com.
"I Just Graduated my 12th Standard(CS with Maths) with good marks. Can I get this course?.
And what if I am not interested in Job Placements and degree. The only thing is I want to Learn AI.
Please Reply
Thanks in Advanced.",Please call us at 91-8106-920-029. We try to clarify all your queries over the phone.
"can we get all the ipython notebook at a particular location for the content that we have completed , this way it'll be easier for us to browse through different codes and concept easily","For that, you can mail us at team@appliedaicourse.com"
"Hello Verma sir,
 I need your valuable advice regarding the following, 
I am currently doing Masters in CSE(NIT bhopal) and I got a 10 month internship offer from Toshiba company, I wanted to how much help will taking up this intership will do to my ML engineer carrier as the intern role would mostly be on java technology and I 
am looking for ML engineer role in product based companies , so how beneficial is  taking up this intership, or should I only look for companies that offer me internship only in ML as from August I have my campus placement commencing. Am really confused pls share your option in making the decision.
Regards",Please drop an mail to team@appliedaicourse.com regarding this so that we can have discussion with you about the same.
I'm bit weak in maths.... Can I join the course?,"Yes, you can. We have many videos on maths which is useful for machine learning. For further inquiry, you can call us on +91 8106-920-029"
"Two suggestions for the website:
1. Instead of displaying the comments with max votes based on the other students, it would be great if the team instructors can vote the comments and then we could be more sure that which are the most important comments that we should go through.
2. Please add the live session videos to the appropriate module videos for which topic the session was held, so that it becomes easier for us to go through the corresponding live session video after completing a particular topic.","Thanks for your feedback.
1. We already have admin vote and that is given by applied team only for particular questions.
2. Yes, we added for some of the live sessions, we will soon update for the rest of them."
As this is one of the best courses...I'm planning to join this course probably by next 2 months. So what about the companies you are referring..I mean are they product based companies?,"Yes, you can see the portfolios of students on our website and list of companies. For more information send us an email at team@appliedaicourse.com"
How to access assignments?/,They are provided under videos named Assignment.
"Spelling mistake: It should be Assignments but not ""Assigments""",Thank you for the correction Pavan.
Can we learn anything without enrolling by paying money,"We didn't get you. Enrollment will be finished only after you make the payment. Once after you are enrolled, you need to finish the course within a span of 1 year."
if i failed to complete this course within 1 year...then would you help us for interviews and take mock test?,"Yes , surely we will help you along the way. But the job guarantee program won't be applicable."
"A general question sir, after completing module 4 and assignment -9 , I am not able to understand which sequence to follow. Is it should be module 5,6,7,8,9 but assignment numbers in classroom given are in different sequence here as 10th assignment is in 7th module. Then I would have to submit assignment 10 after many like 15,16,17,19 and 20.",Just follow the course content and submit it in that order only as there is in course.
what are the major difference between the case studies in our course and the real time data scientist work in companies,The case studies we have done are on a small scale but are very rigourous and complexity is somewhat same as the work a data scientist does.Please bare with the time unless you learn them.
"Hi sir,
If I will complete all assignment and 
course during the valid duration. What are the chances to get jobs","Once after you finish the assignments, we will conduct a written test followed by 2 mock interviews. Depending on your performance, we'll refer you to the jobs. You need to finish minimum 24 assignments in order to attend an interview."
"Hi sir, that means even after completing 30 assignments, if we perform bad or average in 2  mock interview, you wont refer us to better companies?","Depending on your performance, skillset, previous work experience(if any), the mentors would prepare you for the main interviews and in this process you'll have to clear 2 mock interviews which are taken by ML experts from AppliedAI. If you are able to crack those interviews and build a strong portfolio then only you'll be referred to companies."
"Hi sir, then how job guarantee will work now. if we complete 30 assignments and not clear mock interview , that means no referrals and no placement. now, we will get a refund? as we wont get placed. (According to the job guarantee terms). concerned before joinig the course","The day when you register for the course, within 24 hours you'll be given full access to the course. You need to finish the video lectures & assignments(total 30) within an year. Among these 30 assignments, when you finish the first 15 assignments, you'll have 1 round of mock interview & parallelly you'll be made to work on 16-20 assignments. When you finish 20th assignment, you'll have 2nd mock interview. After that you'll be asked to work on 21-30 assignments.
In case if you fail in any of the mock interview, you'll be given some time & the interview will be rescheduled. 
From the day you have finished all the assignments, you'll will be placed within 6 months from that day. If we are not able to get placed even after putting such huge efforts & finishing the assignments, then your course fee of 25K will be refunded.

But during this 6 months in whichever company they refer you(as per your requirement), you have to attend the interview. Even after that if you're still not yet placed, then the course fee of 25K will be refunded. So far no one has reached this stage of getting refund. All those who have finished the course have got placed."
Do you have placements in european countries like Luxembourg?,"For now, we provide placements in India and USA only."
Which companies have recruited for USA positions in the past?,Please send an email to team@appliedaicourse.com
"If we plot a pairplot for 
1)linear regression 
2)classification problems 
So,what does the Gaussian curve or left/right scwed  plot diagonally mean and what is the inference for only diagonal plots
.","Diagonal plot is the distribution plot of that feature. Hence you see the left or right skewed,depending in the distribution of the feature."
"Kindly Provide options like normal videos (pause, play, fast forward) to previous Live session videos, in the desktop application, It's very hard to see the video without that options.","Thanks for your feedback, we will try to make it. For any other suggestions please drop an mail to team@appliedaicourse.com"
"Hello, I want to enrol for Applied Machine Learning Online Course, I have MACBOOK with i5 processor, 128 GB , 8 GB of RAM. Is my Mac enough for taking this course, or do I need to go for windows laptop with high configuration?",Yes it is farely very well.
"I am from Electrical Engineering background.  I have a basic exposure to programming languages like C,C++ and Python. Could I be able to cope up with syllabi prescribed and learn ML as per your schedule?","Yes, if you give enough attention to the course curriculum with the desire to learn, you will surely be able to complete the course and will be able to master the various machine learning algorithms and will know how and when and where to apply after completion of the course. We will help you along the way and will guide you wherever you feel stuck. For more details please drop us a mail at team@appliedaicourse.com"
Please add Bajaj Finserv Emi card for payment. As lot  of students have them.,Kindly mail us at team@appliedaicourse.com with your query regarding this and we will consider it and tell you the various options regarding it.
Does the Applied AI course comprises of all the case studies ?,Yes the machine learning course comprises all the case studies.
"Hi,  anyone suggest me that above course is sufficient enough for complete Data Science course. 
Applied Machine Learning Online Course (it seems they are more focus only on ML and AI).",If you follow the course thoroghly and learn from you end also as much as you can then along with our continuous support you can definitely land in a job of data scientist.
Is this course enough for me to become a good Data Scientist?,"This course covers all the topics in good depth. Along with the course videos, you also need to complete the assignments and the case studies and clear the mock interview sessions in order to get placed in a good company as a Good ML Engineer/Data Scientist. Moreover completing this course is not the end of your learning. You should never stop learning new stuff."
Where can I find the course syllabus pdf?,You can apply for the schedule of yours and this will give you the whole syllabus in .pdf file.
Iam the new joiner how was the course,Kindly start going through the video lectures. Each and every topic is explained in a crystal clear manner.
