question,answer
"It is really great to see exponential growth of AppliedAI. Team's efforts to consider each and every concern, and work on it is very much appreciable. Very soon AppliedAI will be one of top most and successful teaching platform.",Thank you for the kind words and the trusting us. We make sure every student who has trusted us will succeed through our course.
"I also want to make a startup like you in the AI field, this course give me  a good start for ml and deep learning. Till the end of my B.tech ,I want to gain as much as knowledge as possible, or i can say as impossible.Now, finished my first year.
Fully passionate for completing the case studies.","Learn as much as you can from this course and after your 2nd year onwards, start internships and by the time you sit for placements in your final year, you'll get as much exposure. In case if you are interested in  product development companies, along with ML, also gain strong command on CS fundamentals like Data Structures & Algorithms, Design Patterns, Operating Systems, Computer Networks, DBMS. Regarding the start up plans, once if you have some experience of around 3-5 years in the corporate, you can  think of a new startup because in order to run a startup along with the technical stuff, you also need management skills."
"sir, thanks for wonderful suggestions. But  What you suggest me regarding internships, I want to get some real world exposure by doing internship  in these summer vacations, I completed 10 to 11 assinments,
Now In 10 to 15 days I 'll complete all course content, just case studies 'll left after that.
I have full june month for completing some case studies and refresh concepts about machine learning then till the end of june ,I'll apply for internsip.
Is this good idea.","Make sure your internship doesn't clash with your classes in college. Yes you can start applying for internship once if you finish the course. Once if you finish all the course content, there are chances for you to crack internships in top IT companies"
What are design patterns?,"https://en.wikipedia.org/wiki/Software_design_pattern
& https://www.geeksforgeeks.org/design-patterns-set-1-introduction/"
"Hi
first of all thank you for great course
Can you please provide some modules for reinforcement learning.","Adding more content to the current course would make it quite bulky for most of our students to finish and stay motivated through the course. Hence, we did not add Reinforcement Learning (RL) to it as of now. We do not want out our students to be overwhelmed by the course content and workload. While we want to add more content, we don't want to overburden the students.

We will probably create a new course (or) add RL to this course itself in the future (no guarantees) as optional topics. It should be easy for any of our students to pick up RL once they finish this course as they have all of the background in Maths and Deep-Learning.  Please note that no course can cover everything in ML. Often the content in this course itself is split across 2-3 courses. But we designed the course such that students can pick up new concepts fairly easily at the end of the course. Actually, some of our students have picked up RL at the end of this course fairly easily."
"Hi
Then I suggest please add another course for RL. I joined course not due to lack of material for ML online but due to organization and flow of course and the way you teach. So  I request you to please consider this request seriously. I will happily pay for another course from you.",We will surely inform you once we have the Reinforcement course ready (or) when we add RL as an optional content for this course.
"Hi team,
Thank you for your all efforts taken for designing such great content. Especially Varma sir's way of teaching and explaining difficult concepts in a very easy-to-understand manner is praiseworthy.
I have been doing this course for 4 months now and from my experience, I can say that your hard work reflects through all the components of this course, be it teaching, live lectures, doubt solving or the assignments.
I have one suggestion, 
It will be great if you make a telephone line available for doubt clarification regarding the assignments. Many times it's a small workaround that fixes the bug, but waiting for your reply via mail takes about a day and this, in turn, hampers the course progress.
Please make a telephonic helpline available for doubt clarification.",We encourage for doubts through mails. You can contact us at +918106920029/+916301939583 in case if you are looking for a phone call conversation with us.
Can we expect Reinforcement Learning to be added soon??..,"Please go through the comment thread:
http://www.appliedaicourse.com/course/11/applied-machine-learning-online-course#comment346"
"Sir, If this is the case, then my suggestion would be to give some introduction course about reinforcement learning and make it as optional.",We'll think of it.
It would be great in case there be a deep dive in Reinforcement Learning,So far we are not looking towards addding Reinforcement learning. But in future we may add it and you will be able to access it.
Once our validity gets over can we see those videos if you upload in future and do we need pay seperately for that ?,"Once if the course validity is over, you'll not be able to access any content in both website and classroom."
Sir i3 processor with 8Gb RAM is fine to complete this course,Yes it is enough.
Can I learn artificial intelligence in the field of mechatronics?,Please drop us your query at team@appliedaicourse.com. so that we can assist you better.
"HI Team,
I have 10+ years experience in IT. Currently working in Banking product implementation. My main concern is whether switching to AI/ML platform after 10+ experience is right was forward. Is it worth to take the risk of changing the domain now? My contact number: 98941 68004.",See I will suggest it is never late to switch the skills set.If you really want the edge over new skills you can consider it.It totally depends on the interest of one.
"Would like to suggest one functionality.
If you would create one dashboard where will get a ranking based on the respective assignment. It will be great.",Thanks for the suggestion!
"Hi 
Do I get certification after completing my appliedAI course?","Once after completion of the total course, we will send the certificate of completion through Email."
"sir,
In google classroom we can see there are 30 assignments, but in modules there are only 26 assignments including optional, is the number of assignments are reduced?",You will see the other ones in the case studies at the bottom. Also you'll see them getting added in your classroom as you keep progressing through the course.
"How many real-world projects can be done by your course in data science?
How many real-world projects can be done by your course in machine learning?
What is the average package of the students who got placed from your course?
Are all students get the same projects, or each student gets different projects?
Waiting for reply. Thanks in advance",Please call us at 6301-939-583 (or) 8106-920-029. We'll clarify all your doubts.
"Is the syllabus given fixed. I mean is the content team adding new lectures , assignments or case studies ? It would be great to see reinforcement learning added , at least as optional so as to not burden the student with heavy syllabus.
RL is turning out be a very promising field in ML with very interesting applications  .This would be really helpful for those who need it. Thanks",Syllabus  is not fixed we keep adding the contents with time.We appreciate you suggestion and will look forward to it.
"Hi Team,
Can you please provide the assignments at the end of each module which will directly take us to google classroom's assigment?
And provide tick(like for videos) once the assignment is completed and graded by you.",Please drop a mail at team@appliedaicourse.com
"Hi AAIC,

My friend attended interview with Accenture with 2 years Data Science Experience, below are the list of questions was asked to him:

1. Explain about yourself
2. Explain the projects that you worked for
3. What is the difference between logistic and linear
4. What is SIgmoid function
5. What is the difference between sigmoid and softmax function 
6. what is validation
7. what s statification
8. what is bootstrap validation
9. What is cost function
10. Why is cost function so important in model
11. When did you apply cost function 
12. What is optimizer
13.I have 10 Million records with 60 features, what is your approch to build a logistic regression 
 a. which validation you choose
 b. which model you choose
 c. Which optimizer you choose
 d  list the optimizers you know and explain the best one you choose for this problem
 e. Where do you get the data ? is it from online or warehouse?

14.what is clustering and explain various clustering algorithms
15. Write psudo code of Density based clustering
16.Have you ever worked on SVM ? tell me the advantages
17. What is the node entropy
18. How is Rnadom forest is different from Xgboost
19. What are the most significant parameters for the xgboost
20 Why you preferr XG boost for both Liner and logistic
21. What is PCA
22. I applied PCA on 50 features and how many new feature will I get 
23 WHat is Eigan vector
24. How you deploy your model into production 
25. What Hadoop cluster you are using

Please give us some links or study materials if you find any topic missed in AAIC course with respect to above-listed questions. 
Thanks","These are some of the easier questions in interviews. We have covered all go these concepts except (Q-25) about Hadoop in our course. 
For Hadoop cluster, I guess the interviewee mentioned that he is working on Hadoop and hence he was asked which version of Hadoop and which distribution of Hadoop and probably what configuration he was using. We have also not covered (Q-1) as it changes from person to person!"
"Hi, can you please explain what is your answer for below questions

22. I applied PCA on 50 features and how many new feature will I get

13. I have 10 Million records with 60 features, what is your approch to build a logistic regression
a. which validation you choose
b. which model you choose
c. Which optimizer you choose
d list the optimizers you know and explain the best one you choose for this problem
e. Where do you get the data ? is it from online or warehouse?",22. You can get any number of features
"I am glad that all videos are searchable now and AppliedAI team really approachable and day by day you  are getting better,   you are reaching the level customer satisfaction is utmost, you guys are rocking...kudos to the entire team..",Thank you for the feedback!
I like this new site.Can you add a feature where I can see the questions that I have asked and liked module wise and chapter wise ?,Thanks for the suggestion!
can you please describe how tough the assignment is  is there nay video of that assignment so that i can judge myself because in most of the video they are saying that assignment are so tough that its impossible to complete the course in 1 year please give me some clarity,if you are motivated enough you can complete in 1year. if you watch all the videos and if you are clear with concepts you can complete assigments smoothly. some assignments takes time i.e also for machine to train the models and team is always there to help you out(btw i completed in 1year except one assignment)
so if in any case i am stuck at my assignments and i dont know what to do then who will help me and if u guys help me in the assignment then will i be consider for placements,"We'll be helping you out with the assignments and course queries. Yes, you'll be considered."
"and please tell how much students of yours have completed the full course in 1 year ratio wise ...i have a phobia of maths but i know programming ...so can i easily understand the algo like random forest knn,, nd other algo like these buy just watching your videos with 100% intrest",Please send an email to team@appliedaicourse.com
By adding Quiz at the end of every concept/chapter will help students better understanding and motivating?,"As of now, we do not have any plans of it. But in future, we may add it."
"I have 8 years of experience in IT in .NET technology, but now i want to in ML field. So my questions/doubts are below:-
1) Can i change my technology in this much experience and land in a good company as ML engineer.
2) This course is sufficient for me or some other course i need to do along with this.
3) How much it is difficult for me to switch to new technology.",Kindly mail us your contact number to team@appliedaicourse.com so that we can call you and answer all your queries over the phone. Also please mention what would be the best time to contact you.
"Is there content through which we can learn about video analysis, image processing and its applications?","No right now we do not deliver these topics.We teach end to end ML and deep learning along with python and other tools like pandas , numpy,etc"
"will there be any content further?
Please add if possible they are my requirements for projects.",When the new content is added we will notfiy.
Was any new content added i would like to know this to decide weather i should pay this course or not since machine learning is constantly evolving i would like a course that is constantly ipdaying with new content to keep the course uptodate it doesnt matter if the courses is lenghthy or not because at least we will be more prepared and have more things to learn the more the better so im just wandering is the course constantly updating its content,yes course is also constantly evolving as machine learning. every week course instructor will go live for 1-2hrs where he will pick a topic and go in great detail discussing about the topic
"I have logged in with gmail, but i want a seperate username and password to login. What should i do?","you can click on forgot password, then you will get a password reset link through email."
"Sir, I would like to do a PhD in Data Science. How can the Applied ML course help me? Thanks in advance.","This course provides you with a good overview of most of the popular ML and DeepLearning algorithms. But, the mathematical rigor we go into is not at a PhD Level as we focus more on applied and practical aspects more than theoretical proofs. But, we have many PhD students who take this course to understand how various techniques are actually sued in practice."
"Just a Suggestion :

Can you please put all the recorded audio for the query of student by module basis instead of finding it in the comments. This will definitely help student a lot and decrease some amount of question asked to you.",Thanks for the suggestion!
"Hi Team, 
I always had this query, as we all know course validity is 1year and your team adds new content to the playlist every now and then as per your YouTube live sessions,
So how can 1year old student of this course can access the new content, if not then wouldn't it be a loss for  him in terms of knowledge gain.
Please help me with this query and also let me know business timings of your team to have a phone call conversation before I enroll this course. CHEERS!!",The validity of course is 365 days. You can call use between 10 am-6 pm.
I also would like to know. I keep coming back to this website and thinking about enrolling BUT no access to material after 365 days throws me off. I really like the course - to me it would make sense if I do not have access to assignments and future updates. I should have continued access to video content that I use as revision or reference. All other major program providers are giving the live time access ...,Please drop a mail at team@appliedaicourse.com
"I don't know the team's idea regarding 365 days validity, but in my opinion, if the course is life long validity students will not feel the motivation at all to complete it. It just makes us lazy day by day. We may keep on postponing it for 2+ years. That is not at all helpful to someone who wants to grow as  ML engineer or Data scientist.  If one has that utmost interest to complete the course within some stipulated time (even if it is lifetime validity) then it is sure that he can definitely complete it in one year. What it requires is sheer concentration and interest to learn. If it is a limited time period, although we may feel hurry at sometimes we can learn at our own pace and extend the validity after a year and get a highly qualified job. Purpose Served!","Yes, you are correct. This is the reason for 1-year validity."
"Access to course content is different to an actual program. You have dated assignments and deadlines that you have to complete to pass in 365 days. Having access to content for future review is something AppliedAI should consider. Other ML program providers are already doing it. That way you will also gain more students. Sure make deadlines for assignments/case studies/any deliverables, but make content video lectures accessible for lifetime.","Previously we used to have deadlines for the assignments, but this course is not taken only by the students. Even the working professionals are also enrolling for this course and they were not able to meet their deadlines as they have to balance their work, home and this course. So we have removed the topicwise deadlines, but we have kept the course deadline of 365 days like that only. Also 365 days of time is sufficient to complete all the assignments of this course provided if you consistently putting your efforts."
"Hello Sir, Do i need to watch the live sessions in each module after the completion of Course videos of each module, or can i first watch all the course videos, complete the assignments and then watch the live sessions?

Watching Live sessions are necessary for assignment completion, or should i watch them after i have completed the assignments?",We recommend you to watch the live sessions associated with each topic immediately after finishing the chapter asociated with that topic. This way you could learn the topic in much more depth as most of the live sessions are the deep dives of the topics.
"Dear team
A small suggestion to implement if possible.
Could you please highlight the item of Table of Content in the right if we are watching the particular item  video ? For example, module 3, chapter 1, we have 20.4 as Bag of Words. If we are watching the same, Bag of Words item on the right side in Table of Content should be highlighted.",Thanks for your suggestion!
"Could you please add comment section under each assignment in classroom, so we can get clarifications and clear our doubts about the corresponding assignment. The slack doesn't help as it is not inituitive to use also we cant even see past comments beyond few days. It being not organized as per assignment also makes it even difficult to use.
The video in assignment is not enough as lot of time we are stuck trying to solve a problem because of a assumption we eneded up making, just having a comment section helps in removing and clarifying those doubts.
A comment section below each assignment would help a lot.","There is a comment section for each assignment but you can access it once you try to submit the assignment
Please refer to this link. The comment section is placed on the left side of the image."
"It would be preferable to have a comment section where the details of assignment are given. As there is lot of small doubts about what the assignemnt is asking or when there is a bit of ambiguity eg in  formulas,  if everything is in summation or part of it. or if while taking samples is it with or without replacement. Such little confusion take up a lot of time. So if others have such issues those can be resolved in comment and can be answered.  Because the team still takes a day to answer. Common doubts can quickly get resolved as once the team answers the confusion can be removed once for all",Thanks for the suggestion!
"1.Do we have to complete the live session videos in chapter 1 compulsorily to get course completion?
2. Will it be added for other modules as well apart from python?","Just to clarify,course completion is not about the video completion but about the assignment completion"
Do you recommend 1st Year Engineering students to join the course or wait till second year till all the fundamentals of CS is clear?,First year student can join because all the programming fundamentals are also covered in the course. Person with no programming background can join.
"Hello Team,

Thanks for the new look of the website with additional features.

Just wanted to provide some suggestion on the navigation of the particular topic w.r.t  breadcrumbs on the top, in each of the topic page.

For example,  Log Normal Distribution in Probability and Statistics,  can be displayed like below:
Home -> Courses -> Applied Machine Learning Online Course-> Data Science : Explanatory Data Analysis and Data Visualization -> Probability and Statistics -> 12.15 Log Normal Distribution

Now it's displaying like below  :
Home -> Courses -> Applied Machine Learning Online Course-> Log Normal Distribution

If the same is implemented, we can navigate to any of the module, chapter or topic, etc.",Thank you for the feedback! We'll include it in our next iteration of updates.
"Sir, Which white board tool youare using for conducting the session?",We use Ink2Go.
Do we need to do log transformation on both dependent variable and independents variables in linear and logistic regression,"Usually, it is done on independent variables."
sir..as srikanth sir mentioned in live session there will be interview questions after each chapter.. but i cant able to find that.. can you please guide me where ill found that or give any link of them..,"In each module, you can find a few chapters named 'Interview Questions on topic'. The questions start from Probability and statistics chapter."
"hi sir, i wanted to know what type of projects we can put in resumes after completing the course , as we cant put netflix recommendation system, amazon food reviews as our projects , so please suggest what type of projects we can put in resume to get calls.","You can put the case studies covered in the course as projects in your resume. But, we would suggest you put your own self case studies other than those covered in the course. You will get more ideas as you go through videos."
"Hi, for microsoft malware case study , can I do this on google colab instead of google cloud or azure ?Because I cant do it on local machine.",Yes you can run that on google colab.
Have this course contain anything about reinforcement learning?,"As of now, Reinforcement Learning is not yet added, but in future we may add it to the course."
"Please add it in the course, because without reinforcement learning AI is incomplete I think.",Thanks for the suggestion!
Have this course contain any videos about Q learning?,"No, we have not covered q-learning in this course."
"Sir, Can I get a job in tier-1 companies just with the completion of this course(with 80% in assessments) or I will have to do something else(additional).","Yes, you have to finish the case studies in this course and we have mentors to guide you in preparation for the companies you target for and also we help you with profile building that matches the company's expectations."
"Can in this course have any content for in depth use of various deep learning libraries like TensorFlow and PyTorch, Keras, etc.",We have used tensorflow and keras in the course.
"Can I get any Certificate,  after finish this course ?","Yes, you will get a course completion certificate if you finish all the assignments and get them evaluated."
What the system requirement need for this course.,"It is good to have a laptop with around 8Gb of RAM minimum,with i7 processor, 4G graphics card from NVIDIA(if you want to run deep learning programs which is optional, generally 1050Ti and above is preferable). You can also look into Google Colab for running the code."
If i use Google Colab then can I use properly all of things in this course or it give me a limitation.,You can use Google Colab. There is no limitation.
"Hello, what are the prerequisites to join this course? Do we need to know any programming languages or have an understanding of AI?",There are no prerequisites for this course. A programming language is taught in the course.
"Hi team,
I want to learn datastructure and algorithms.And,I know only Python,which I learned from here.So,please guide me.","You can refer GeeksForGeeks to learn Data Structures and Algorithms.
You also can refer the book Introduction to Algorithms here."
"Please increase the logged in session time. After watching a 30 min video it again ask for login. It is really frustrating to keep login every time. Once the login is done, it redirects to the main website page, then again we have to traverse to machine learning course page, then again to our module and then click to next video. Please understand this minute but irritating problem and solve it. Thanks",Thank you for the feedback. We'll do the needful.
What can the ApplieAI team say about the average package from the Job gaurantee programme(for a fresher)??,"The average package for a candidate depends on different factors like the candidate's educational background, skillset the candidate possess, type of the company the candidate is trying for, type of projects/portfolio the candidate has worked on, etc. We suggest you to kindly call us on 91-8106-920-029 for further queries regarding the job guarantee program."
